project_id,project,quantity,quantity_type,status,funding_millions,evidence_class,source_keys,notes
battery_point_apartments,Battery Point Apartments,162,planned_units,remobilizing_construction,100.0,official_project_status,crescentcity_housing_update2025;batterypoint2026resume,Flagship affordable project on former Hussey Texaco parcel; funding and remobilization status are official or project-reported current-status claims.
other_near_term_city_pipeline,Other near-term city pipeline,130,planned_units,official_pipeline_forecast,,official_project_status,crescentcity_housing_update2025,Derived from city-reported expectation of 292 new units within two years minus 162 Battery Point units; treated as pipeline estimate not delivered inventory.
project_based_vouchers,Project-based vouchers committed,150,committed_vouchers,operating_subsidy_committed,,official_project_status,crescentcity_housing_update2025,City update reports more than 150 project-based vouchers committed to four upcoming housing projects; vouchers support affordability but are not identical to physical units.
danco_senior_housing,Competitive PLHA for Danco senior housing,5,funding_millions,funding_awarded,5.0,official_project_status,crescentcity_housing_update2025;westerncity2026housing,Competitive Permanent Local Housing Allocation funding reported for senior-housing project; plotted as funding context rather than unit count.
valhalla_rehabilitation,Valhalla rehabilitation LMIHF award,0.3,funding_millions,rehabilitation_funding,0.3,official_project_status,crescentcity_housing_update2025,Low-to-Moderate Income Housing Fund allocation for rehabilitation; plotted as funding context rather than new unit count.
